{
  "$schema": "https://json-schema.org/draft/2020-12/schema",
  "$id": "https://example.invalid/paper-deep-analysis/analysis.schema.json",
  "title": "Paper deep analysis",
  "type": "object",
  "additionalProperties": false,
  "required": [
    "schema_version",
    "paper",
    "analysis_context",
    "analysis_boundary",
    "executive_summary",
    "contributions",
    "method",
    "evidence_assessment",
    "claims",
    "critical_assessment",
    "reproducibility",
    "profile_analysis",
    "open_questions",
    "references"
  ],
  "properties": {
    "schema_version": {"const": "0.1.0"},
    "paper": {"$ref": "#/$defs/paper"},
    "analysis_context": {"$ref": "#/$defs/context"},
    "analysis_boundary": {"$ref": "#/$defs/boundary"},
    "executive_summary": {
      "type": "object",
      "additionalProperties": false,
      "required": ["one_sentence", "why_it_matters", "bottom_line"],
      "properties": {
        "one_sentence": {"$ref": "#/$defs/nonEmpty"},
        "why_it_matters": {"$ref": "#/$defs/nonEmpty"},
        "bottom_line": {"$ref": "#/$defs/nonEmpty"}
      }
    },
    "contributions": {
      "type": "array",
      "minItems": 1,
      "items": {"$ref": "#/$defs/statement"}
    },
    "method": {
      "type": "object",
      "additionalProperties": false,
      "required": ["problem", "approach", "workflow", "assumptions"],
      "properties": {
        "problem": {"$ref": "#/$defs/statement"},
        "approach": {"$ref": "#/$defs/statement"},
        "workflow": {
          "type": "array",
          "minItems": 1,
          "items": {"$ref": "#/$defs/statement"}
        },
        "assumptions": {
          "type": "array",
          "items": {"$ref": "#/$defs/statement"}
        }
      }
    },
    "evidence_assessment": {
      "type": "object",
      "additionalProperties": false,
      "required": ["study_design", "datasets", "baselines", "metrics", "ablations", "negative_results"],
      "properties": {
        "study_design": {"$ref": "#/$defs/assessmentItem"},
        "datasets": {"$ref": "#/$defs/assessmentItem"},
        "baselines": {"$ref": "#/$defs/assessmentItem"},
        "metrics": {"$ref": "#/$defs/assessmentItem"},
        "ablations": {"$ref": "#/$defs/assessmentItem"},
        "negative_results": {"$ref": "#/$defs/assessmentItem"}
      }
    },
    "claims": {
      "type": "array",
      "minItems": 1,
      "items": {"$ref": "#/$defs/claim"}
    },
    "critical_assessment": {
      "type": "object",
      "additionalProperties": false,
      "required": ["strengths", "limitations", "threats_to_validity", "missing_evidence", "overall_judgment"],
      "properties": {
        "strengths": {"type": "array", "items": {"$ref": "#/$defs/statement"}},
        "limitations": {"type": "array", "minItems": 1, "items": {"$ref": "#/$defs/statement"}},
        "threats_to_validity": {"type": "array", "items": {"$ref": "#/$defs/statement"}},
        "missing_evidence": {"type": "array", "items": {"$ref": "#/$defs/statement"}},
        "overall_judgment": {"$ref": "#/$defs/statement"}
      }
    },
    "reproducibility": {
      "type": "object",
      "additionalProperties": false,
      "required": ["code", "data", "environment", "replication_notes"],
      "properties": {
        "code": {"enum": ["available", "partial", "not_reported", "unavailable"]},
        "data": {"enum": ["available", "partial", "not_reported", "unavailable", "not_applicable"]},
        "environment": {"enum": ["specified", "partial", "not_reported"]},
        "replication_notes": {"$ref": "#/$defs/statement"}
      }
    },
    "profile_analysis": {
      "type": "object",
      "additionalProperties": false,
      "required": ["profile", "insights"],
      "properties": {
        "profile": {"enum": ["general", "agent-systems", "data-agent", "custom"]},
        "insights": {"type": "array", "items": {"$ref": "#/$defs/statement"}}
      }
    },
    "open_questions": {
      "type": "array",
      "items": {"$ref": "#/$defs/statement"}
    },
    "references": {
      "type": "array",
      "items": {
        "type": "object",
        "additionalProperties": false,
        "required": ["label", "url", "kind"],
        "properties": {
          "label": {"$ref": "#/$defs/nonEmpty"},
          "url": {"type": "string", "format": "uri", "pattern": "^https://"},
          "kind": {"enum": ["paper", "code", "data", "project", "related"]}
        }
      }
    }
  },
  "$defs": {
    "nonEmpty": {"type": "string", "minLength": 1, "maxLength": 4000},
    "paper": {
      "type": "object",
      "additionalProperties": false,
      "required": ["stable_id", "title", "authors", "identifiers", "source_url", "published", "updated", "license"],
      "properties": {
        "stable_id": {"type": "string", "pattern": "^[a-z0-9][a-z0-9._-]{2,127}$"},
        "title": {"type": "string", "minLength": 1, "maxLength": 1000},
        "authors": {"type": "array", "minItems": 1, "items": {"type": "string", "minLength": 1, "maxLength": 300}},
        "identifiers": {
          "type": "object",
          "additionalProperties": false,
          "required": ["arxiv", "doi", "sha256"],
          "properties": {
            "arxiv": {"type": ["string", "null"], "maxLength": 50},
            "doi": {"type": ["string", "null"], "maxLength": 300},
            "sha256": {"type": "string", "pattern": "^[a-f0-9]{64}$"}
          }
        },
        "source_url": {"type": ["string", "null"], "format": "uri"},
        "published": {"type": ["string", "null"], "format": "date"},
        "updated": {"type": ["string", "null"], "format": "date"},
        "license": {"type": "string", "minLength": 1, "maxLength": 500},
        "venue": {"type": ["string", "null"], "maxLength": 500}
      }
    },
    "context": {
      "type": "object",
      "additionalProperties": false,
      "required": ["language", "profile", "reader_context", "focus_questions"],
      "properties": {
        "language": {"type": "string", "minLength": 2, "maxLength": 50},
        "profile": {"enum": ["general", "agent-systems", "data-agent", "custom"]},
        "reader_context": {"type": "string", "maxLength": 2000},
        "focus_questions": {"type": "array", "items": {"type": "string", "minLength": 1, "maxLength": 1000}}
      }
    },
    "boundary": {
      "type": "object",
      "additionalProperties": false,
      "required": ["basis", "model", "host", "visuals_inspected", "extraction_warnings"],
      "properties": {
        "basis": {"enum": ["full_text", "partial_text", "abstract_only"]},
        "model": {"type": "string", "minLength": 1, "maxLength": 200},
        "host": {"type": "string", "minLength": 1, "maxLength": 200},
        "visuals_inspected": {"type": "array", "items": {"type": "string", "maxLength": 300}},
        "extraction_warnings": {"type": "array", "items": {"type": "string", "maxLength": 1000}}
      }
    },
    "anchor": {
      "type": "object",
      "additionalProperties": false,
      "required": ["page", "section", "figure", "table", "note"],
      "properties": {
        "page": {"type": ["integer", "null"], "minimum": 1},
        "section": {"type": ["string", "null"], "maxLength": 300},
        "figure": {"type": ["string", "null"], "maxLength": 100},
        "table": {"type": ["string", "null"], "maxLength": 100},
        "note": {"type": "string", "maxLength": 500}
      },
      "anyOf": [
        {"required": ["page"], "properties": {"page": {"type": "integer"}}},
        {"required": ["section"], "properties": {"section": {"type": "string", "minLength": 1}}}
      ]
    },
    "statement": {
      "type": "object",
      "additionalProperties": false,
      "required": ["id", "text", "attribution", "confidence", "evidence_strength", "anchors", "tags"],
      "properties": {
        "id": {"type": "string", "pattern": "^[a-z][a-z0-9-]{2,79}$"},
        "text": {"type": "string", "minLength": 1, "maxLength": 4000},
        "attribution": {"enum": ["paper_claim", "analyst_inference", "derived_lesson"]},
        "confidence": {"enum": ["high", "medium", "low"]},
        "evidence_strength": {"enum": ["strong", "moderate", "weak", "not_reported"]},
        "anchors": {"type": "array", "items": {"$ref": "#/$defs/anchor"}},
        "tags": {"type": "array", "items": {"type": "string", "pattern": "^[a-z0-9][a-z0-9._-]{0,49}$"}, "uniqueItems": true}
      }
    },
    "claim": {
      "type": "object",
      "additionalProperties": false,
      "required": ["id", "text", "attribution", "confidence", "evidence_strength", "anchors", "tags", "claim_type", "support"],
      "properties": {
        "id": {"type": "string", "pattern": "^[a-z][a-z0-9-]{2,79}$"},
        "text": {"type": "string", "minLength": 1, "maxLength": 4000},
        "attribution": {"enum": ["paper_claim", "analyst_inference", "derived_lesson"]},
        "confidence": {"enum": ["high", "medium", "low"]},
        "evidence_strength": {"enum": ["strong", "moderate", "weak", "not_reported"]},
        "anchors": {"type": "array", "items": {"$ref": "#/$defs/anchor"}},
        "tags": {"type": "array", "items": {"type": "string", "pattern": "^[a-z0-9][a-z0-9._-]{0,49}$"}, "uniqueItems": true},
        "claim_type": {"enum": ["novelty", "method", "empirical", "efficiency", "generalization", "safety", "limitation", "other"]},
        "support": {"type": "string", "minLength": 1, "maxLength": 2000}
      }
    },
    "assessmentItem": {
      "type": "object",
      "additionalProperties": false,
      "required": ["status", "summary", "anchors"],
      "properties": {
        "status": {"enum": ["adequate", "mixed", "weak", "not_reported", "not_applicable"]},
        "summary": {"type": "string", "minLength": 1, "maxLength": 3000},
        "anchors": {"type": "array", "items": {"$ref": "#/$defs/anchor"}}
      }
    }
  }
}
