{
  "schema_version": "0.1.0",
  "paper": {
    "stable_id": "2607.28033",
    "title": "DataClawEval: A Benchmark for Data Engineering Agents in Real Industrial Harness",
    "authors": [
      "Debin Meng",
      "Jiaming Yang",
      "Zefang Zong",
      "Tengyue Xu",
      "Haining Xie",
      "Yang Li",
      "Peng Chen"
    ],
    "identifiers": {
      "arxiv": "2607.28033",
      "doi": null,
      "sha256": "038c793698ab91ec168f536621744d00a433ee4ef385f90986f0ca4484e13cfc"
    },
    "source_url": "https://arxiv.org/abs/2607.28033",
    "published": "2026-07-30",
    "updated": "2026-07-30",
    "license": "unknown (not verified during the local-PDF run)",
    "venue": "KDD '27 (stated in the PDF; publication status not independently verified)"
  },
  "analysis_context": {
    "language": "zh-CN",
    "profile": "data-agent",
    "reader_context": "关注 Data Agent、Agent 辅助数据工程、数据质量与 Agent 持续改进的产品与研究读者",
    "focus_questions": [
      "这篇工作是否真正覆盖端到端数据工程，而不只是 Text-to-SQL？",
      "证据能否支持对 Data Agent 可靠性、跨引擎能力和评测方式的结论？",
      "哪些机制可以迁移到 Data Agent 产品、数据质量平台和持续学习闭环？"
    ]
  },
  "analysis_boundary": {
    "basis": "full_text",
    "model": "OpenAI Codex",
    "host": "Codex Desktop",
    "visuals_inspected": [
      "Figure 2 on PDF page 4",
      "overall-score formula and evaluation dimensions on PDF page 5",
      "Table 2 on PDF page 6",
      "Table 3 and Figure 3 on PDF page 7",
      "Figure 4 on PDF page 8",
      "Table 5 and Figure 5 on PDF page 13",
      "Figure 6, Table 6/7, and Figure 7 on PDF page 14"
    ],
    "extraction_warnings": [
      "Two-column text extraction occasionally interleaves columns; key figures, tables, and quantitative claims were checked against rendered pages.",
      "The benchmark code, containers, and grader outputs were not executed in this reading run."
    ]
  },
  "executive_summary": {
    "one_sentence": "DataClawEval 将 Data Agent 评测从单步查询生成推进到真实执行环境中的数据探索、实现、调试、物化与验收，并用任务级确定性 grader 同时检查最终数据产物和工程过程。",
    "why_it_matters": "对数据工程而言，最危险的问题往往不是 SQL 无法运行，而是任务显示成功却产生错误数据；论文把静默错误、跨引擎差异、重复运行稳定性和工具成本放进同一证据链，直接对应 Data Agent 产品的验收、观测和接管机制。",
    "bottom_line": "这是一篇对 Data Agent 评测设计很有价值的 benchmark 论文，但不能把其综合分解释为生产成功率，也不能把固定 CodeBuddy scaffold 下的模型后端排名外推为完整 Agent 产品排名；单企业来源、任务重建、单次主实验和缺少跨 Harness/人工基线仍限制结论。"
  },
  "contributions": [
    {
      "id": "contribution-end-to-end-benchmark",
      "text": "构建 100 个端到端数据工程任务，覆盖 PySpark、HiveSQL、MySQL、PrestoSQL/Trino 和 FlinkSQL，并要求 Agent 在隔离环境中探索、实现、执行、调试和物化数据产物。",
      "attribution": "paper_claim",
      "confidence": "high",
      "evidence_strength": "strong",
      "anchors": [{"page": 1, "section": "Abstract and 1 Introduction", "figure": null, "table": null, "note": "任务规模、引擎和端到端定位"}],
      "tags": ["benchmark", "data-agent", "execution"]
    },
    {
      "id": "contribution-construction-pipeline",
      "text": "从生产代码出发，经脱敏、去重、意图与输入重建、扰动实现和差分执行，形成可执行且能区分正确/错误逻辑的任务。",
      "attribution": "paper_claim",
      "confidence": "high",
      "evidence_strength": "moderate",
      "anchors": [{"page": 4, "section": "3.1 DataClawEval Construction", "figure": "Figure 2", "table": null, "note": "数据集构造上半部分和可辨识性循环"}],
      "tags": ["dataset-construction", "differential-testing"]
    },
    {
      "id": "contribution-artifact-process-grading",
      "text": "为每个任务编写确定性评分脚本，既执行并核对 schema、行级、数值和分类字段，也评价探索、执行效率和自验证过程。",
      "attribution": "paper_claim",
      "confidence": "high",
      "evidence_strength": "strong",
      "anchors": [{"page": 5, "section": "3.2 Evaluation Framework", "figure": null, "table": null, "note": "Artifact-oriented 与 process-oriented evaluation"}],
      "tags": ["data-quality", "grader", "evaluation"]
    },
    {
      "id": "contribution-reliability-analysis",
      "text": "在统一 scaffold 下比较 16 个模型后端，并进一步分析跨引擎表现、三次重复运行、LLM Judge 偏差、低分失败、超时和工具调用效率。",
      "attribution": "paper_claim",
      "confidence": "high",
      "evidence_strength": "strong",
      "anchors": [{"page": 6, "section": "4 Experiments", "figure": null, "table": "Table 2", "note": "主实验"}, {"page": 7, "section": "5 Analysis", "figure": "Figure 3", "table": "Table 3", "note": "Judge 与稳定性"}, {"page": 13, "section": "Appendix B/C", "figure": "Figure 5", "table": "Table 5", "note": "低分和超时"}],
      "tags": ["reliability", "stability", "failure-analysis"]
    }
  ],
  "method": {
    "problem": {
      "id": "method-problem-end-to-end-gap",
      "text": "现有 Text-to-SQL 与数据分析 benchmark 多以固定 schema 下的查询或最终答案为目标，缺少对真实数据工程任务中 schema 探索、跨引擎执行、调试、结果物化与过程可靠性的联合评测。",
      "attribution": "paper_claim",
      "confidence": "high",
      "evidence_strength": "moderate",
      "anchors": [{"page": 2, "section": "1 Introduction and Table 1", "figure": null, "table": "Table 1", "note": "论文对代表性 benchmark 的能力维度比较"}],
      "tags": ["text-to-sql", "evaluation-gap"]
    },
    "approach": {
      "id": "method-approach-two-pipelines",
      "text": "方法把任务构造和 Agent 评测耦合：先把生产实现转成可公开执行且可辨识的任务，再让 Agent 在按 case 初始化的 Docker 环境中交付产物，由任务专属 grader 给出产物分与过程分。",
      "attribution": "paper_claim",
      "confidence": "high",
      "evidence_strength": "strong",
      "anchors": [{"page": 4, "section": "3 DataClawEval", "figure": "Figure 2", "table": null, "note": "两条流水线总览"}],
      "tags": ["sandbox", "grader", "workflow"]
    },
    "workflow": [
      {
        "id": "method-workflow-source-curation",
        "text": "对专业数据工程师编写的生产代码进行脱敏、去重和分层采样。",
        "attribution": "paper_claim",
        "confidence": "high",
        "evidence_strength": "moderate",
        "anchors": [{"page": 4, "section": "3.1 Stage 1", "figure": "Figure 2", "table": null, "note": "Dataset construction 起点"}],
        "tags": ["curation", "privacy"]
      },
      {
        "id": "method-workflow-reconstruct-task",
        "text": "使用 LLM 根据实现和 schema 重建用户意图与输入表，并通过执行循环修订任务。",
        "attribution": "paper_claim",
        "confidence": "high",
        "evidence_strength": "moderate",
        "anchors": [{"page": 4, "section": "3.1 Stage 2", "figure": "Figure 2", "table": null, "note": "自动生成的意图和输入不等同于原始生产请求"}],
        "tags": ["task-reconstruction", "llm-synthesis"]
      },
      {
        "id": "method-workflow-differential-check",
        "text": "专家扰动正确实现，要求正确实现与扰动实现对合成输入产生可区分输出，以降低“错误实现也能通过”的假阳性。",
        "attribution": "paper_claim",
        "confidence": "high",
        "evidence_strength": "moderate",
        "anchors": [{"page": 4, "section": "3.1 Stage 3", "figure": "Figure 2", "table": null, "note": "answer-identifiable task construction"}],
        "tags": ["differential-testing", "test-quality"]
      },
      {
        "id": "method-workflow-build-grader",
        "text": "任务级 grade.py 根据业务语义检查可执行性、schema、行级结果、数值和分类正确性，并由多名专家审计。",
        "attribution": "paper_claim",
        "confidence": "high",
        "evidence_strength": "moderate",
        "anchors": [{"page": 5, "section": "3.1 Stage 4/5", "figure": null, "table": null, "note": "任务评分与最终专家验证"}],
        "tags": ["grader", "human-review", "data-contract"]
      },
      {
        "id": "method-workflow-run-agent",
        "text": "每个 case 在独立容器中启动所需数据服务和工具；Agent 看不到参考实现与 grader，结束后再在同一环境执行评分。",
        "attribution": "paper_claim",
        "confidence": "high",
        "evidence_strength": "strong",
        "anchors": [{"page": 5, "section": "3.2 and 4.1 Settings", "figure": null, "table": null, "note": "隔离执行与信息边界"}],
        "tags": ["container", "isolation", "evaluation"]
      }
    ],
    "assumptions": [
      {
        "id": "assumption-reconstructed-task-fidelity",
        "text": "LLM 重建后的意图与输入仍足以代表原生产代码对应的工程语义。",
        "attribution": "analyst_inference",
        "confidence": "medium",
        "evidence_strength": "weak",
        "anchors": [{"page": 4, "section": "3.1 Stage 2", "figure": "Figure 2", "table": null, "note": "论文描述审计，但未给出原始意图与重建意图的一致性指标"}],
        "tags": ["construct-validity", "task-reconstruction"]
      },
      {
        "id": "assumption-grader-completeness",
        "text": "任务 grader 覆盖了足以代表业务正确性的字段、边界条件和执行过程。",
        "attribution": "analyst_inference",
        "confidence": "medium",
        "evidence_strength": "weak",
        "anchors": [{"page": 5, "section": "3.1 Stage 4/5", "figure": null, "table": null, "note": "规则经过专家检查，但未报告 grader 漏检率"}],
        "tags": ["grader", "business-semantics"]
      },
      {
        "id": "assumption-fixed-harness-controls-model",
        "text": "固定 CodeBuddy scaffold 能有效控制 Harness 差异，使主表差异主要来自模型后端。",
        "attribution": "paper_claim",
        "confidence": "medium",
        "evidence_strength": "moderate",
        "anchors": [{"page": 6, "section": "4.1 Settings", "figure": null, "table": null, "note": "控制了 scaffold，但没有跨 Harness 消融"}],
        "tags": ["harness", "model-comparison"]
      },
      {
        "id": "assumption-score-weighting",
        "text": "多数任务使用的产物 0.7、过程 0.3 权重能够表达数据工程质量的相对重要性。",
        "attribution": "analyst_inference",
        "confidence": "medium",
        "evidence_strength": "weak",
        "anchors": [{"page": 5, "section": "3.2 Overall score", "figure": null, "table": null, "note": "论文允许任务设计者调整 alpha，但未报告权重敏感性"}],
        "tags": ["rubric", "weighting"]
      }
    ]
  },
  "evidence_assessment": {
    "study_design": {
      "status": "mixed",
      "summary": "主实验为 16 个模型后端 × 100 个任务，统一容器和 scaffold；但每个模型—任务组合在主实验只运行一次，随机性没有进入主榜单区间。",
      "anchors": [{"page": 5, "section": "4.1 Settings", "figure": null, "table": null, "note": "single run per combination"}, {"page": 6, "section": "4.2 Main Results", "figure": null, "table": "Table 2", "note": "主实验规模"}]
    },
    "datasets": {
      "status": "mixed",
      "summary": "任务由真实企业生产代码衍生且覆盖五种执行引擎，但来源集中于单一企业，并经过脱敏、LLM 重建和输入合成，外部有效性与原业务分布仍有距离。",
      "anchors": [{"page": 3, "section": "2 Preliminaries", "figure": null, "table": null, "note": "生产代码来源和任务分布"}, {"page": 4, "section": "3.1", "figure": "Figure 2", "table": null, "note": "重建流程"}]
    },
    "baselines": {
      "status": "mixed",